{
  "record_version": "1.0.0",
  "state": "AWAITING_REAL_MAINTAINER_ACCEPTANCE",
  "maintainer_reference": null,
  "authority_evidence_reference": null,
  "accepted_source_revision": null,
  "accepted_scope_checksum": null,
  "accepted_contract_checksums": null,
  "accepted_at": null,
  "decision_record_reference": null,
  "authorize_rc1": false,
  "authorize_final_release": false
}
